{
  "project_id": "PRJ-2026-0001",
  "title": "Demo R&D Project",
  "status": "needs_review",
  "objectives": [
    {
      "objective_id": "OBJ-2026-0001",
      "title": "Review project KPI readiness",
      "weight": null,
      "status": "active",
      "linked_kpis": ["KPI-01"],
      "linked_milestones": [],
      "linked_evidence_ids": [],
      "linked_report_paths": [],
      "review_status": "needs_review",
      "notes": "Local operating objective; review before use.",
      "risk_flags": []
    }
  ],
  "deadlines": [
    {
      "deadline_id": "DL-2026-0001",
      "due_date": "2026-06-30",
      "title": "Monthly report review",
      "deliverable_type": "report_review",
      "linked_objective_ids": ["OBJ-2026-0001"],
      "linked_kpis": [],
      "linked_milestones": [],
      "linked_evidence_ids": [],
      "linked_report_paths": ["reports/monthly-report.md"],
      "approval_required": true,
      "status": "planned",
      "review_status": "needs_review",
      "notes": "Local operating deadline; not an official agency schedule.",
      "risk_flags": []
    }
  ],
  "notes": "Local K-ResDev operating file. Review and edit before relying on goals/deadline projections.",
  "warnings": ["needs_review"]
}
